{"allowed_profile_ids":["new-feature","bug-fix","hotfix","refactor-debt","migration","dependency-security","performance","release-operations","incident-response"],"approved_profile_registry_digest":"sha256-jcs-v1:694655c82293cbf25b41dca7a1c87e3d37989eb11058375ed1c778786b268fdc","artifact_compaction_mapping":[],"budget_policy":{"mode":"preserve","overrides":[]},"coverage_policy_digest":"sha256-jcs-v1:946c6f6875ef74e944be328de0ecb0a936f44ef937bd5d556ae5450610f8f488","digest":"sha256-jcs-v1:42de44fd595f82ff9f4d2916dbd1994542db2b15e7c117d881f9cb6b07522d50","edge_additions":[],"entry_condition_ids":["approved-intent-baseline"],"exit_condition_ids":["trustworthy-completion"],"forbidden_profile_ids":[],"merge_rules":[],"node_additions":[],"overlay_id":"full-planned","required_invariant_ids":["authority","completion","digest","finite-budget","independent-review","invalidation","replay-protection","schema"],"schema_version":"1.0.0","version":"1.0.0"}
