{"allowed_profile_ids":["new-feature","bug-fix","hotfix","refactor-debt","migration","dependency-security","performance","release-operations","incident-response"],"approved_profile_registry_digest":"sha256-jcs-v1:694655c82293cbf25b41dca7a1c87e3d37989eb11058375ed1c778786b268fdc","artifact_compaction_mapping":[],"budget_policy":{"mode":"tighten","overrides":[{"budget_id":"loop:bounded-v1","maximum":2}]},"coverage_policy_digest":"sha256-jcs-v1:946c6f6875ef74e944be328de0ecb0a936f44ef937bd5d556ae5450610f8f488","digest":"sha256-jcs-v1:3133953b0756d173bc9712f5f865bdde3579c217524b4047f3e06d20bf1c0d97","edge_additions":["emergency-containment-to-recovery","emergency-impact-to-containment","emergency-postmortem-to-completion","emergency-recovery-to-postmortem"],"entry_condition_ids":["action-authority-confirmed","approved-emergency-intent-baseline"],"exit_condition_ids":["evidence-recorded","postmortem-required","rollback-or-compensation-ready","target-recovered"],"forbidden_profile_ids":[],"merge_rules":[],"node_additions":["emergency-containment","emergency-impact-assessment","emergency-postmortem","emergency-recovery"],"overlay_id":"emergency","required_invariant_ids":["authority","completion","digest","finite-budget","independent-review","invalidation","replay-protection","schema"],"schema_version":"1.0.0","version":"1.0.0"}
